0	I spent the past three years talking to some of the worst people on the internet.
1	Now, if you've been online recently, you may have noticed that there's a lot of toxic garbage out there: racist memes, misogynist propaganda, viral misinformation.
2	So I wanted to know who was making this stuff.
3	I wanted to understand how they were spreading it.
4	Ultimately, I wanted to know what kind of impact it might be having on our society.
5	So in 2016, I started tracing some of these memes back to their source, back to the people who were making them or who were making them go viral.
6	"I'd approach those people and say, ""Hey, I'm a journalist."
7	"Can I come watch you do what you do?"""
8	"Now, often the response would be, ""Why in hell would I want to talk to some low-t soy-boy Brooklyn globalist Jew cuck who's in cahoots with the Democrat Party?"""
9	(Laughter)
10	"To which my response would be, ""Look, man, that's only 57 percent true."""
11	(Laughter)
12	But often I got the opposite response.
13	"""Yeah, sure, come on by."""
14	So that's how I ended up in the living room of a social media propagandist in Southern California.
15	He was a married white guy in his late 30s.
16	He had a table in front of him with a mug of coffee, a laptop for tweeting, a phone for texting and an iPad for livestreaming to Periscope and YouTube.
17	That was it.
18	And yet, with those tools, he was able to propel his fringe, noxious talking points into the heart of the American conversation.
19	For example, one of the days I was there, a bomb had just exploded in New York, and the guy accused of planting the bomb had a Muslim-sounding name.
20	Now, to the propagandist in California, this seemed like an opportunity, because one of the things he wanted was for the US to cut off almost all immigration, especially from Muslim-majority countries.
21	So he started livestreaming, getting his followers worked up into a frenzy about how the open borders agenda was going to kill us all and asking them to tweet about this, and use specific hashtags, trying to get those hashtags trending.
22	And tweet they did — hundreds and hundreds of tweets, a lot of them featuring images like this one.
23	So that's George Soros.
24	He's a Hungarian billionaire and philanthropist, and in the minds of some conspiracists online, George Soros is like a globalist bogeyman, one of a few elites who is secretly manipulating all of global affairs.
25	Now, just to pause here: if this idea sounds familiar to you, that there are a few elites who control the world and a lot of them happen to be rich Jews, that's because it is one of the most anti-Semitic tropes in existence.
26	I should also mention that the guy in New York who planted that bomb, he was an American citizen.
27	So whatever else was going on there, immigration was not the main issue.
28	And the propagandist in California, he understood all this.
29	He was a well-read guy.
30	He was actually a lawyer.
31	He knew the underlying facts, but he also knew that facts do not drive conversation online.
32	What drives conversation online is emotion.
33	See, the original premise of social media was that it was going to bring us all together, make the world more open and tolerant and fair ... And it did some of that.
34	But the social media algorithms have never been built to distinguish between what's true or false, what's good or bad for society, what's prosocial and what's antisocial.
35	That's just not what those algorithms do.
36	A lot of what they do is measure engagement: clicks, comments, shares, retweets, that kind of thing.
37	"And if you want your content to get engagement, it has to spark emotion, specifically, what behavioral scientists call ""high-arousal emotion."""
38	"Now, ""high arousal"" doesn't only mean sexual arousal, although it's the internet, obviously that works."
39	It means anything, positive or negative, that gets people's hearts pumping.
40	So I would sit with these propagandists, not just the guy in California, but dozens of them, and I would watch as they did this again and again successfully, not because they were Russian hackers, not because they were tech prodigies, not because they had unique political insights — just because they understood how social media worked, and they were willing to exploit it to their advantage.
41	Now, at first I was able to tell myself this was a fringe phenomenon, something that was relegated to the internet.
42	But there's really no separation anymore between the internet and everything else.
43	This is an ad that ran on multiple TV stations during the 2018 congressional elections, alleging with very little evidence that one of the candidates was in the pocket of international manipulator George Soros, who is awkwardly photoshopped here next to stacks of cash.
44	This is a tweet from the President of the United States, alleging, again with no evidence, that American politics is being manipulated by George Soros.
45	This stuff that once seemed so shocking and marginal and, frankly, just ignorable, it's now so normalized that we hardly even notice it.
46	So I spent about three years in this world.
47	I talked to a lot of people.
48	Some of them seemed to have no core beliefs at all.
49	They just seemed to be betting, perfectly rationally, that if they wanted to make some money online or get some attention online, they should just be as outrageous as possible.
50	But I talked to other people who were true ideologues.
51	And to be clear, their ideology was not traditional conservatism.
52	These were people who wanted to revoke female suffrage.
53	These were people who wanted to go back to racial segregation.
54	Some of them wanted to do away with democracy altogether.
55	Now, obviously these people were not born believing these things.
56	They didn't pick them up in elementary school.
57	A lot of them, before they went down some internet rabbit hole, they had been libertarian or they had been socialist or they had been something else entirely.
58	So what was going on?
59	Well, I can't generalize about every case, but a lot of the people I spoke to, they seem to have a combination of a high IQ and a low EQ.
60	They seem to take comfort in anonymous, online spaces rather than connecting in the real world.
61	So often they would retreat to these message boards or these subreddits, where their worst impulses would be magnified.
62	"They might start out saying something just as a sick joke, and then they would get so much positive reinforcement for that joke, so many meaningless ""internet points,"" as they called it, that they might start believing their own joke."
63	I talked a lot with one young woman who grew up in New Jersey, and then after high school, she moved to a new place and suddenly she just felt alienated and cut off and started retreating into her phone.
64	She found some of these spaces on the internet where people would post the most shocking, heinous things.
65	And she found this stuff really off-putting but also kind of engrossing, kind of like she couldn't look away from it.
66	She started interacting with people in these online spaces, and they made her feel smart, they made her feel validated.
67	She started feeling a sense of community, started wondering if maybe some of these shocking memes might actually contain a kernel of truth.
68	A few months later, she was in a car with some of her new internet friends headed to Charlottesville, Virginia, to march with torches in the name of the white race.
69	She'd gone, in a few months, from Obama supporter to fully radicalized white supremacist.
70	Now, in her particular case, she actually was able to find her way out of the cult of white supremacy.
71	But a lot of the people I spoke to were not.
72	"And just to be clear: I was never so convinced that I had to find common ground with every single person I spoke to that I was willing to say, ""You know what, man, you're a fascist propagandist, I'm not, whatever, let's just hug it out, all our differences will melt away."""
73	No, absolutely not.
74	But I did become convinced that we cannot just look away from this stuff.
75	We have to try to understand it, because only by understanding it can we even start to inoculate ourselves against it.
76	In my three years in this world, I got a few nasty phone calls, even some threats, but it wasn't a fraction of what female journalists get on this beat.
77	And yeah, I am Jewish, although, weirdly, a lot of the Nazis couldn't tell I was Jewish, which I frankly just found kind of disappointing.
78	(Laughter)
79	Seriously, like, your whole job is being a professional anti-Semite.
80	Nothing about me is tipping you off at all?
81	Nothing?
82	(Laughter)
83	This is not a secret.
84	"My name is Andrew Marantz, I write for ""The New Yorker,"" my personality type is like if a Seinfeld episode was taped at the Park Slope Food Coop."
85	Nothing?
86	(Laughter)
87	Anyway, look — ultimately, it would be nice if there were, like, a simple formula: smartphone plus alienated kid equals 12 percent chance of Nazi.
88	It's obviously not that simple.
89	And in my writing, I'm much more comfortable being descriptive, not prescriptive.
90	But this is TED, so let's get practical.
91	I want to share a few suggestions of things that citizens of the internet like you and I might be able to do to make things a little bit less toxic.
92	So the first one is to be a smart skeptic.
93	So, I think there are two kinds of skepticism.
94	And I don't want to drown you in technical epistemological information here, but I call them smart and dumb skepticism.
95	So, smart skepticism: thinking for yourself, questioning every claim, demanding evidence — great, that's real skepticism.
96	Dumb skepticism: it sounds like skepticism, but it's actually closer to knee-jerk contrarianism.
97	Everyone says the earth is round, you say it's flat.
98	"Everyone says racism is bad, you say, ""I dunno, I'm skeptical about that."""
99	"I cannot tell you how many young white men I have spoken to in the last few years who have said, ""You know, the media, my teachers, they're all trying to indoctrinate me into believing in male privilege and white privilege, but I don't know about that, man, I don't think so."""
100	Guys — contrarian white teens of the world — look: if you are being a round earth skeptic and a male privilege skeptic and a racism is bad skeptic, you're not being a skeptic, you're being a jerk.
101	(Applause)
102	It's great to be independent-minded, we all should be independent-minded, but just be smart about it.
103	So this next one is about free speech.
104	"You will hear smart, accomplished people who will say, ""Well, I'm pro-free speech,"" and they say it in this way that it's like they're settling a debate, when actually, that is the very beginning of any meaningful conversation."
105	All the interesting stuff happens after that point.
106	OK, you're pro-free speech.
107	What does that mean?
108	Does it mean that David Duke and Richard Spencer need to have active Twitter accounts?
109	Does it mean that anyone can harass anyone else online for any reason?
110	You know, I looked through the entire list of TED speakers this year.
111	I didn't find a single round earth skeptic.
112	Is that a violation of free speech norms?
113	Look, we're all pro-free speech, it's wonderful to be pro-free speech, but if that's all you know how to say again and again, you're standing in the way of a more productive conversation.
114	Making decency cool again, so ... Great!
115	(Applause)
116	Yeah.
117	I don't even need to explain it.
118	"So in my research, I would go to Reddit or YouTube or Facebook, and I would search for ""sharia law"" or I would search for ""the Holocaust,"" and you might be able to guess what the algorithms showed me, right?"
119	"""Is sharia law sweeping across the United States?"""
120	"""Did the Holocaust really happen?"""
121	Dumb skepticism.
122	So we've ended up in this bizarre dynamic online, where some people see bigoted propaganda as being edgy or being dangerous and cool, and people see basic truth and human decency as pearl-clutching or virtue-signaling or just boring.
123	And the social media algorithms, whether intentionally or not, they have incentivized this, because bigoted propaganda is great for engagement.
124	Everyone clicks on it, everyone comments on it, whether they love it or they hate it.
125	So the number one thing that has to happen here is social networks need to fix their platforms.
126	(Applause)
127	So if you're listening to my voice and you work at a social media company or you invest in one or, I don't know, own one, this tip is for you.
128	If you have been optimizing for maximum emotional engagement and maximum emotional engagement turns out to be actively harming the world, it's time to optimize for something else.
129	(Applause)
130	But in addition to putting pressure on them to do that and waiting for them and hoping that they'll do that, there's some stuff that the rest of us can do, too.
131	So, we can create some better pathways or suggest some better pathways for angsty teens to go down.
132	If you see something that you think is really creative and thoughtful and you want to share that thing, you can share that thing, even if it's not flooding you with high arousal emotion.
133	Now that is a very small step, I realize, but in the aggregate, this stuff does matter, because these algorithms, as powerful as they are, they are taking their behavioral cues from us.
134	So let me leave you with this.
135	You know, a few years ago it was really fashionable to say that the internet was a revolutionary tool that was going to bring us all together.
136	It's now more fashionable to say that the internet is a huge, irredeemable dumpster fire.
137	Neither caricature is really true.
138	We know the internet is just too vast and complex to be all good or all bad.
139	And the danger with these ways of thinking, whether it's the utopian view that the internet will inevitably save us or the dystopian view that it will inevitably destroy us, either way, we're letting ourselves off the hook.
140	There is nothing inevitable about our future.
141	The internet is made of people.
142	People make decisions at social media companies.
143	People make hashtags trend or not trend.
144	People make societies progress or regress.
145	When we internalize that fact, we can stop waiting for some inevitable future to arrive and actually get to work now.
146	You know, we've all been taught that the arc of the moral universe is long but that it bends toward justice.
147	Maybe.
148	Maybe it will.
149	But that has always been an aspiration.
150	It is not a guarantee.
151	The arc doesn't bend itself.
152	It's not bent inevitably by some mysterious force.
153	The real truth, which is scarier and also more liberating, is that we bend it.
154	Thank you.
155	(Applause)
0	I have two passions: first football.
1	I am a super fan, let's see if you can guess the team.
2	(Laughter) I am of course, a Real Madrid fan.
3	I am also a goalkeeper at the Villanubla football club.
4	My other passion are computers, video games and programming, which is what I am going to talk about today.
5	During playtime, we kids go crazy about Wii, PSP and Nintendo.
6	We always try to play a little more by finishing our home works faster by cleaning up our bedroom, whatever it takes in order to pass the level, or to beat our previous scores.
7	One day I thought: What if instead of just playing, I could create my own screens, heroes and bad guys, punches, pirouettes and extra lives?
8	Unattainable?
9	No, no.
10	A child my age can do it!
11	While new technologies are everywhere, and grownups use them for their stuff, such as computers in the cars — although my parents still get lost — cell phones, checking up emails, shopping, going through the internet; children use them to play.
12	Because we are children, and that's what we like the most.
13	We all know that for us children, it is second nature to handle those tech devices that many adults — Maybe because we're not afraid to touch, to try things out and see what is in there, or even break them, because parents can later fix everything up.
14	(Laughter) This childlike curiosity helped me create my own games.
15	I realized that I could learn by playing and play while learning.
16	I could experiment, create, share, understand and reason how things are made, and then use that with everything else I was learning.
17	Turns out that all that learning is what adults call Creative Computing.
18	I was once told that programming is like a play.
19	We have a scenario with our actors who will interact upon our instructions.
20	We can disguise them to create animations or add up images, sounds, etc.
21	You probably think: this sounds good, but a little kid, alone in his room, programming — Not exactly social.
22	Well, there is more to it than that.
23	It's an open, public community worldwide, where we can belong and where we can publish our programs, or download programs and play with them, see how they were made, modify or improve them.
24	Nowadays, this community shares more than 10,000 programs, in a community of children, grownups, and professors of colleges, institutes and universities.
25	As I became more and more passionate, I made new friends with whom I shared creations, then I thought that if I taught my schoolmates they could also enjoy as much as I.
26	Besides, programming helps me learn in a very fun way what we were learning at school.
27	It was an aha moment.
28	Last year, when we were learning about human bones in class I came up with a Q&A game, this is it: (Video) I'll show you the game I created to learn the human skeleton bones for a class I had last year.
29	In this game the human body asks you where the bones are.
30	I'll click the green check I'll display it full screen, and it asks you where the jaw is?
31	you have to answer with the right number if it is 10, 11, 1, 2 or 3.
32	"I answer 10 which is the right one and it says ""Correeeect!"""
33	"but if your answer is wrong it says: ""Wah, wah, wah""."
34	I recorded and added every sound to the game, I added right and wrong answers.
35	The program scores right and deducts wrong answers so I can now play and compete with my friends, to see who knows the human bones better.
36	(Applauses) I had so much fun programming the game and it became so helpful for my learning, that I asked my teacher if we could use it in class.
37	I wanted to show everybody, and so I did.
38	We picked a day for me to show my classmates all those projects, I showed them how they were as capable as me to do the same.
39	Of course, they loved it.
40	"Children and teachers liked it so much, that this year we founded The Programming Club ""El páramo de Villanubla"" a group of 26 children, so far, who enjoy programming individually or as a team."
41	Now I am working on a game about space (Video) I am going to show you the game I created with the video sensor, about planets and the solar system.
42	You have to head punch the planets so they don't fall into the sea.
43	I switch to full screen I added right and wrong answers, and here is the sea.
44	The planets start to fall, You aim the camera towards you so it follows your head movements to head punch the planets on the screen, if you hit them, you hear the name and the planet shape switches into a label on the screen.
45	and it scores points for every head punch.
46	But if you fail to punch the planet, you hear them fall into the sea and a point gets deducted from the score.
47	Well, I think you get the idea.
48	(Applause) Isn't it cool?
49	And knowing that I did it, makes it better!
50	Besides I'm going to show it to the 5-year-old kids at school who are learning about the solar system, and I bet this game will help them learn better.
51	This makes me even happier, knowing that my games are not just fun, but useful.
52	Yet, it's not the first time I program something for the little kids at school.
53	Since my parents noticed that I liked it and I was doing well at school, when I turned 7, I got a present.
54	When I first saw it, I was like, What is this, some cables?
55	"And they told me: ""With this you'll do magic."""
56	They were right, I'm going to show you.
57	It was a Makey Makey board.
58	By connecting it to a computer, you can plug cables to anything as original as gummies, play dough, fruit, pencils, water or just by touching them, make programs and games work as if it is magic.
59	I told this to Marga, the teacher of the 4 year olds at my school and she asked me if we could do a special project about music and orchestra instruments.
60	Both teachers and students would make instruments with cardboard and foamy.
61	meanwhile, I had to build the necessary programs so that the instruments would come to life and sound real.
62	So I told this to Juanje, a friend of mine, and we both started working.
63	For us this was an interesting project but it was challenging: because little kids were supposed to listen to us, and we are children too!
64	When everything was set, we gather all the kids and showed them the sound of their instruments.
65	We even taught them that they too had music within.
66	It was mind blowing!
67	Little kids were great.
68	We organized groups so everyone could play their instruments.
69	We were truly seen as magicians who had used some cables and a computer to impress both adults and kids.
70	Well, do you want to se how we did it?
71	I'm going to show you I brought some of those instruments.
72	By the way, I want to thank my school for letting me show you a bit of that magic, something any kid can do just with a little of imagination, cables and a computer To play this super piano made by four year olds, I have to remove my shoes.
73	My feet are clean, eh!
74	(Laughter) Let's see if you know this song.
75	(Music) (Applause) Now I'm going to show you how water makes more sounds than those made when it comes out of the faucet.
76	This song is dedicated to my grandma because next week is her birthday (Laughter) (Applause) (Music) (Applause) I will now need four volunteers.
77	Here and now we are going to hear their sound.
78	Let's see, the four guys over there.
79	(Laughter) (Applause) Pick this one.
80	You pick that one.
81	Let's hear what instrument you sound like.
82	(Noise) Wow!
83	you sound like a noise!
84	(Battery dish) You sound like battery dishes You have no sound.
85	(Laughter) (Drum roll) You sound like a drum.
86	And you, let's see what do you sound like.
87	(Neighing) Oh we have a horse!!
88	(Laughter) (Applause) I hope you enjoyed what I brought to you.
89	See how I was not fooling you?
90	You can imagine, create and share just with some cables, a bit of imagination and a computer.
91	Try it out kids!
92	Stop just being gamers, and become creators of stories, game programs and musical projects.
93	Our imagination is the limit.
94	But go beyond!
95	Show it to the world, upload it to the web for others to see, and more people can play, but knowing that we as kids, can decide too how we want things done.
96	And I ask all the parents that please help us put together programming workshops at schools so every kid can learn this.
97	It is important for your kids.
98	(Applause) Never forget that nothing is impossible, It's all up to our effort and desire of self-improvement, even if we are young, we have a lot to teach in return.
99	Thank you so much for your attention, see you soon.
100	(Applause)
0	Ever since computers were invented, we've been trying to make them smarter and more powerful.
1	From the abacus, to room-sized machines, to desktops, to computers in our pockets.
2	And are now designing artificial intelligence to automate tasks that would require human intelligence.
3	If you look at the history of computing, we've always treated computers as external devices that compute and act on our behalf.
4	What I want to do is I want to weave computing, AI and internet as part of us.
5	As part of human cognition, freeing us to interact with the world around us.
6	Integrate human and machine intelligence right inside our own bodies to augment us, instead of diminishing us or replacing us.
7	Could we combine what people do best, such as creative and intuitive thinking, with what computers do best, such as processing information and perfectly memorizing stuff?
8	Could this whole be better than the sum of its parts?
9	We have a device that could make that possible.
10	It's called AlterEgo, and it's a wearable device that gives you the experience of a conversational AI that lives inside your head, that you could talk to in likeness to talking to yourself internally.
11	We have a new prototype that we're showing here, for the first time at TED, and here's how it works.
12	Normally, when we speak, the brain sends neurosignals through the nerves to your internal speech systems, to activate them and your vocal cords to produce speech.
13	One of the most complex cognitive and motor tasks that we do as human beings.
14	Now, imagine talking to yourself without vocalizing, without moving your mouth, without moving your jaw, but by simply articulating those words internally.
15	Thereby very subtly engaging your internal speech systems, such as your tongue and back of your palate.
16	When that happens, the brain sends extremely weak signals to these internal speech systems.
17	AlterEgo has sensors, embedded in a thin plastic, flexible and transparent device that sits on your neck just like a sticker.
18	These sensors pick up on these internal signals sourced deep within the mouth cavity, right from the surface of the skin.
19	An AI program running in the background then tries to figure out what the user's trying to say.
