77	And engaging with other scientists, doctors, ethicists and governments to maximize the likelihood that base editing is applied thoughtfully, safely and ethically, remains a critical obligation.
78	"These challenges notwithstanding, if you had told me even just five years ago that researchers around the globe would be using laboratory-evolved molecular machines to directly convert an individual base pair to another base pair at a specified location in the human genome efficiently and with a minimum of other outcomes, I would have asked you, ""What science-fiction novel are you reading?"""
79	Thanks to a relentlessly dedicated group of students who were creative enough to engineer what we could design ourselves and brave enough to evolve what we couldn't, base editing has begun to transform that science-fiction-like aspiration into an exciting new reality, one in which the most important gift we give our children may not only be three billion letters of DNA, but also the means to protect and repair them.
80	Thank you.
81	(Applause)
82	Thank you.
0	I could fit all movies ever made inside of this tube.
1	If you can't see it, that's kind of the point.
2	(Laughter)
3	Before we understand how this is possible, it's important to understand the value of this feat.
4	All of our thoughts and actions these days, through photos and videos — even our fitness activities — are stored as digital data.
5	Aside from running out of space on our phones, we rarely think about our digital footprint.
6	But humanity has collectively generated more data in the last few years than all of preceding human history.
7	Big data has become a big problem.
8	Digital storage is really expensive, and none of these devices that we have really stand the test of time.
9	There's this nonprofit website called the Internet Archive.
10	In addition to free books and movies, you can access web pages as far back as 1996.
11	Now, this is very tempting, but I decided to go back and look at the TED website's very humble beginnings.
12	As you can see, it's changed quite a bit in the last 30 years.
13	So this led me to the first-ever TED, back in 1984, and it just so happened to be a Sony executive explaining how a compact disk works.
14	(Laughter)
15	Now, it's really incredible to be able to go back in time and access this moment.
16	It's also really fascinating that after 30 years, after that first TED, we're still talking about digital storage.
17	Now, if we look back another 30 years, IBM released the first-ever hard drive back in 1956.
18	Here it is being loaded for shipping in front of a small audience.
19	It held the equivalent of one MP3 song and weighed over one ton.
20	At 10,000 dollars a megabyte, I don't think anyone in this room would be interested in buying this thing, except maybe as a collector's item.
21	But it's the best we could do at the time.
22	We've come such a long way in data storage.
23	Devices have evolved dramatically.
24	But all media eventually wear out or become obsolete.
25	If someone handed you a floppy drive today to back up your presentation, you'd probably look at them kind of strange, maybe laugh, but you'd have no way to use the damn thing.
26	These devices can no longer meet our storage needs, although some of them can be repurposed.
27	All technology eventually dies or is lost, along with our data, all of our memories.
28	There's this illusion that the storage problem has been solved, but really, we all just externalize it.
29	We don't worry about storing our emails and our photos.
30	They're just in the cloud.
31	But behind the scenes, storage is problematic.
32	After all, the cloud is just a lot of hard drives.
33	Now, most digital data, we could argue, is not really critical.
34	Surely, we could just delete it.
35	But how can we really know what's important today?
36	We've learned so much about human history from drawings and writings in caves, from stone tablets.
37	We've deciphered languages from the Rosetta Stone.
38	You know, we'll never really have the whole story, though.
39	Our data is our story, even more so today.
40	We won't have our record recorded on stone tablets.
41	But we don't have to choose what is important now.
42	There's a way to store it all.
43	It turns out that there's a solution that's been around for a few billion years, and it's actually in this tube.
44	DNA is nature's oldest storage device.
45	After all, it contains all the information necessary to build and maintain a human being.
46	But what makes DNA so great?
47	Well, let's take our own genome as an example.
48	If we were to print out all three billion A's, T's, C's and G's on a standard font, standard format, and then we were to stack all of those papers, it would be about 130 meters high, somewhere between the Statue of Liberty and the Washington Monument.
49	Now, if we converted all those A's, T's, C's and G's to digital data, to zeroes and ones, it would total a few gigs.
50	And that's in each cell of our body.
51	We have more than 30 trillion cells.
52	You get the idea: DNA can store a ton of information in a minuscule space.
53	DNA is also very durable, and it doesn't even require electricity to store it.
54	We know this because scientists have recovered DNA from ancient humans that lived hundreds of thousands of years ago.
55	One of those is Ötzi the Iceman.
56	Turns out, he's Austrian.
57	(Laughter)
58	He was found high, well-preserved, in the mountains between Italy and Austria, and it turns out that he has living genetic relatives here in Austria today.
59	So one of you could be a cousin of Ötzi.
60	(Laughter)
61	The point is that we have a better chance of recovering information from an ancient human than we do from an old phone.
62	It's also much less likely that we'll lose the ability to read DNA than any single man-made device.
63	Every single new storage format requires a new way to read it.
64	We'll always be able to read DNA.
65	If we can no longer sequence, we have bigger problems than worrying about data storage.
66	Storing data on DNA is not new.
67	Nature's been doing it for several billion years.
68	In fact, every living thing is a DNA storage device.
69	But how do we store data on DNA?
70	This is Photo 51.
71	It's the first-ever photo of DNA, taken about 60 years ago.
72	This is around the time that that same hard drive was released by IBM.
73	So really, our understanding of digital storage and of DNA have coevolved.
74	We first learned to sequence, or read DNA, and very soon after, how to write it, or synthesize it.
75	This is much like how we learn a new language.
76	And now we have the ability to read, write and copy DNA.
77	We do it in the lab all the time.
78	So anything, really anything, that can be stored as zeroes and ones can be stored in DNA.
79	To store something digitally, like this photo, we convert it to bits, or binary digits.
80	Each pixel in a black-and-white photo is simply a zero or a one.
81	And we can write DNA much like an inkjet printer can print letters on a page.
82	We just have to convert our data, all of those zeroes and ones, to A's, T's, C's and G's, and then we send this to a synthesis company.
83	So we write it, we can store it, and when we want to recover our data, we just sequence it.
84	Now, the fun part of all of this is deciding what files to include.
85	We're serious scientists, so we had to include a manuscript for good posterity.
86	We also included a $50 Amazon gift card — don't get too excited, it's already been spent, someone decoded it — as well as an operating system, one of the first movies ever made and a Pioneer plaque.
87	Some of you might have seen this.
88	It has a depiction of a typical — apparently — male and female, and our approximate location in the Solar System, in case the Pioneer spacecraft ever encounters extraterrestrials.
89	So once we decided what sort of files we want to encode, we package up the data, convert those zeroes and ones to A's, T's, C's and G's, and then we just send this file off to a synthesis company.
90	And this is what we got back.
91	Our files were in this tube.
92	All we had to do was sequence it.
93	This all sounds pretty straightforward, but the difference between a really cool, fun idea and something we can actually use is overcoming these practical challenges.
94	Now, while DNA is more robust than any man-made device, it's not perfect.
95	It does have some weaknesses.
96	We recover our message by sequencing the DNA, and every time data is retrieved, we lose the DNA.
97	That's just part of the sequencing process.
98	We don't want to run out of data, but luckily, there's a way to copy the DNA that's even cheaper and easier than synthesizing it.
99	We actually tested a way to make 200 trillion copies of our files, and we recovered all the data without error.
100	So sequencing also introduces errors into our DNA, into the A's, T's, C's and G's.
101	Nature has a way to deal with this in our cells.
102	But our data is stored in synthetic DNA in a tube, so we had to find our own way to overcome this problem.
103	We decided to use an algorithm that was used to stream videos.
104	When you're streaming a video, you're essentially trying to recover the original video, the original file.
105	When we're trying to recover our original files, we're simply sequencing.
106	But really, both of these processes are about recovering enough zeroes and ones to put our data back together.
107	And so, because of our coding strategy, we were able to package up all of our data in a way that allowed us to make millions and trillions of copies and still always recover all of our files back.
108	This is the movie we encoded.
109	It's one of the first movies ever made, and now the first to be copied more than 200 trillion times on DNA.
110	"Soon after our work was published, we participated in an ""Ask Me Anything"" on the website reddit."
111	If you're a fellow nerd, you're very familiar with this website.
112	Most questions were thoughtful.
113	Some were comical.
114	For example, one user wanted to know when we would have a literal thumb drive.
115	Now, the thing is, our DNA already stores everything needed to make us who we are.
116	It's a lot safer to store data on DNA in synthetic DNA in a tube.
117	Writing and reading data from DNA is obviously a lot more time-consuming than just saving all your files on a hard drive — for now.
118	So initially, we should focus on long-term storage.
119	Most data are ephemeral.
120	It's really hard to grasp what's important today, or what will be important for future generations.
121	But the point is, we don't have to decide today.
122	"There's this great program by UNESCO called the ""Memory of the World"" program."
123	It's been created to preserve historical materials that are considered of value to all of humanity.
124	Items are nominated to be added to the collection, including that film that we encoded.
125	While a wonderful way to preserve human heritage, it doesn't have to be a choice.
126	Instead of asking the current generation — us — what might be important in the future, we could store everything in DNA.
127	Storage is not just about how many bytes but how well we can actually store the data and recover it.
128	There's always been this tension between how much data we can generate and how much we can recover and how much we can store.
129	Every advance in writing data has required a new way to read it.
130	We can no longer read old media.
131	How many of you even have a disk drive in your laptop, never mind a floppy drive?
132	This will never be the case with DNA.
133	As long as we're around, DNA is around, and we'll find a way to sequence it.
134	Archiving the world around us is part of human nature.
135	This is the progress we've made in digital storage in 60 years, at a time when we were only beginning to understand DNA.
136	Yet, we've made similar progress in half that time with DNA sequencers, and as long as we're around, DNA will never be obsolete.
137	Thank you.
138	(Applause)
0	Hi.
1	I'm Maisie Williams.
2	And I'm kind of just waiting for someone to come on stage and tell me that there's been some sort of miscommunication, and that I should probably leave.
3	No?
4	Damn it.
5	(Laughter) So, some of you may know me as an actress.
6	(Cheers) (Laughter) Some of you may know me for my really average tweets.
7	(Cheers) Oh, yeah.
8	And some of you may be finding out who I am for the first time right now.
9	Hello.
10	Whether you knew me before or not, you're probably wondering what I'm going to talk to you about today.
11	And I would be lying if I said it didn't take me one or two sleepless nights, trying to figure that out, too.
12	At last, here I am.
13	"Upon finding out the news that I would be giving a TEDx Talk, I did what I think most people do and watched about 50 TED talks back-to-back, and read ""Talk like TED"" by Carmine Gallo for some inspiration."
14	Was I inspired?
15	Yes and no.
16	Did it make me want to go out and change the world?
17	Hell yeah.
18	Did it make me feel like a totally inadequate public speaker with absolutely no point to make, who was definitely in need of a big thesaurus if she wants to keep up?
19	Indeed.
20	What could I possibly say that would have any impact?
21	What point am I trying to make?
22	And who the hell thought it was a good idea to give me a TEDx talk?
23	So here's the part where I tell you what I know: I'm the youngest of four siblings.
24	My parents divorced when I was four months old.
25	I really was the icing on the cake of a terrible marriage.
26	(Laughter) I have two step siblings who are younger than me and a half brother who's older than all of us.
27	I grew up in a three-bedroom council house with four of my six siblings just outside of Bristol.
28	I went to a very ordinary school.
29	I got very ordinary grades.
30	I wasn't quite good enough to get a gold star, and I also wasn't quite bad enough to be kept after school.
31	I walked that nice center line where if I kept my mouth shut in class, then I could probably get away with not being spoken to you by teachers for weeks on end.
32	Everything about me was pretty damn ordinary, except for how I felt on the inside.
33	I had big dreams.
34	Shock.
35	From as young as I can remember, I have dreamed of becoming a professional dancer.
36	There are certain memories from my childhood that I would really rather forget.
37	But during those times of immense pain, I found myself instinctively walking over to my mother's CD player, cranking up the volume to drown out the noise and letting my body move to the beat.
38	It's hard to describe how it felt.
39	I was harnessing emotions that I didn't even really know the names of yet.
40	I was summoning all of this energy and feeling it flow through my body and out of my fingertips.
41	I was alone in my own head, and I felt the most alive.
42	I didn't really know much about the big wide world then, but I knew that this feeling was addictive; and I was going to stop at nothing until I made it my profession.
43	At eight years old, I was enrolled in dance class.
44	And by ten, I informed my mother that I didn't want to go to school anymore.
45	I wanted to be like Billy Elliot and go to stage school.
46	This was the first opportunity or challenge I was presented with.
47	Even as young as ten, I was willing to give up all of my friends and go away to board at a private school, away from my siblings, away from my mom.
48	"She would repeatedly ask me, ""Are you sure this is what you want?"""
49	And to me, it was a no-brainer.
50	I didn't just want this; I needed it.
51	My grubby knees and crooked teeth were not on the list of requirements for becoming a professional dancer.
52	And when I look back now, both myself and my mother looked severely out of place.
53	But at the time, I was just too young and naive to feel inadequate.
54	I didn't care.
55	If Billy Elliot could do it, so could I.
56	Once my audition was done, I returned home for two weeks of staring out the window, waiting for the postman, waiting for my ticket out of my sleepy village and into a world of jazz hands and dorm rooms.
57	It was good news followed by bad news: I had got in, but the fees to attend a school like this were not cheap, and despite my best efforts, I had not received any government funding.
58	I auditioned again the following year.
59	And this time, I received 40% funding, but this was still just money that we didn't have, and it broke my heart.
60	I was good enough.
61	I made the cut.
62	But I wasn't going anywhere.
63	It was a blessing in disguise, although if anyone had said that to me back then, I probably would've given them the finger and told them to jog on.
64	I wasn't willing to give up that easily.
65	So at age 11, I was bursting with excitement when my dance teacher informed me of a talent show which boasted opportunities of making you a star.
66	This was the second opportunity I was faced with.
67	I entered into singing, acting, dancing and modeling.
68	The talent show consisted of workshops and seminars with specialists who would help train you up for your performance at the end of the week.
69	"After meeting a woman called Louise Johnston in an improvisation acting workshop, she gave me the words ""bowling ball,"" and asked me to create a short scene inspired by these words."
70	After making her laugh with a fictional story, of how I threw a bowling ball at my brother and it bounced, she asked me to join her acting agency.
71	I didn't really know what this meant.
72	I knew that I would do auditions for films and maybe become an actor, but I still had big dreams of becoming a professional dancer, so this woman was going to have to work a lot harder than that if she was going to convince eleven-year-old me that I was going to become an actress.
73	Was this going to take time away from the 30 hours of dancing I was doing a week?
74	And what if I didn't get the part?
75	Was this going to be too upsetting?
76	And do actresses have teeth like mine?
77	Because if they do, I'm yet to watch any of their movies.
78	"After meeting Louise in the February of 2009 and trying but failing to land the part in the hit sequel ""Nanny McPhee"" to ""The Big Bang,"" my second audition was for a show called ""Game of Thrones."""
79	This was the third opportunity or challenge I was presented with.
80	I climbed the steps to the Methodist Church with my mother's hand in mine.
81	I perched my tiny bottom in one of the seats outside the audition room and listened to an annoying girl with her even more annoying mother tell me all about the number of auditions she had done prior to this one.
82	And also about her pet fish.
83	My name was called, then I stepped inside.
84	I had a hard Bristolian accent and dark rings around my eyes that were so big they took up half my face and a hole in the knee of my trousers which I tried to cover with my left hand as I was talking to the kind lady who taped my audition.
85	But as soon as she pressed record, it all drifted away.
86	Much like when I was dancing in my mother's living room, I harnessed all of my insecurities and self-doubt and let it flow through the words that came out of my mouth.
87	I was cheeky.
88	I was loud.
89	I was angry.
90	And for this, I was perfect.
91	After getting the part and shooting the pilot episode, the show slowly grew to become one of the biggest shows in television history.
92	To this day, we've smashed previous HBO viewing records.
93	We've been nominated for over 130 Emmys, making us the most Emmy-nominated show to ever exist.
94	We've recently finished shooting our eighth and final season, which is predicted to smash records that we've already broken.
95	And nearly a decade to the day since my first audition, I'm still wondering, when am I going to get to be Billy Elliot?
96	(Laughter) I joke, but in all seriousness, I have absolutely no plans of slowing down.
97	Throughout my time in this industry, it has been a minefield.
98	I have grown from a child into an adult, and from four feet tall into a whopping five feet tall.
99	"(Laughter) I have constantly been trying to say the right thing, accidentally saying the wrong thing, trying not to swear too much and trying to stop saying ""like, like"" all of the time."
100	In February of 2017, a friend of mine, Dom, and I were swigging beers in my kitchen, and he confessed to me that there is a huge problem with the creative industries.
101	I agreed.
102	The series of events that had got me to that point were based mainly on luck and timing and were unable to be recreated.
103	He suggested to me that we create a social media, but just for artists to be able to collaborate with one another and create a career.
104	This was the fourth opportunity or challenge I was presented with.
105	"""Great,"" I thought."
106	"""How the hell do we do that?"""
107	And daisie was born.
108	Of course, everyone who I spoke to about my latest endeavor thought that I was mad; however, I know that this is something that I can help change.
109	This last year in the industry, we've seen a huge shift with the Me Too movement.
110	The industry is built with gatekeepers holding all of the power and selecting who they deem talented enough to advance to the next level.
111	More often than not, it's easier to catch the attention of those people if you have graduated from an expensive school.
112	But even then, I have so many friends who are fresh out of art school, having trained for years and are still no closer to creating a career.
113	Now, I'm not claiming that with daisie I can make everybody a star, but I do believe that the key to success within creative industries is collaborating.
114	Actors are only as good as their writers.
115	Musicians are only as strong as their producers.
116	And designers need their teams.
117	To start the company, we self-funded.
118	"I had a pot of cash from ""Game of Thrones"" that I was free to invest wherever I liked."
119	Dom had a series of businesses from the age of 16, which meant he was also left with a pot of cash.
120	We threw our money together 50-50, and we built a team.
121	Now, Lady Gaga has repeatedly said that there could be a room of 100 people, and 99 don't believe in you, but it just takes that one person to believe in you, and they can change your life.
122	Well, now we have a team of six.
123	Over the next 16 months, we built our MVP.
124	Now, if you're wondering what an MVP is, I only found out what it is about six months ago.
125	And from what I can gather, it's a product which proves as a problem worth solving with the minimum team effort.
126	So basically from my point of view, you're marketing something which you know is going to be good one day, but is a little bit bad right now.
127	And for us, that was an iOS app.
128	The six of us made an office in Dom's garden, and on August 1, 2018, we released our version one.
129	We had over 30,000 downloads in the first 24 hours and over 30,000 comments asking when the Android version was going to be coming.
130	Despite our app being imperfect, buggy and literally built by one man alone, this was exactly what we needed for people to invest.
131	We learned a lot from our angry users and our scary investors.
132	And over the last six months, we have grown our team to 16 people.
133	From then till now, we've been building version two, which we will be launching in April.
134	Within the industry, there is a common phrase which I think we're all pretty familiar with.
135	"And that is, ""It's not what you know, it's who you know."""
136	And with daisie, I hope to give that power back to the creator.
137	I want to encourage people to create a list of contacts that they will work with and support as they take their first steps into the fickle and often challenging creative world.
138	I am of the generation who grew up with the Internet.
139	I've never known anything else.
140	We are connected, we are aware, and we are the future.
141	I hope daisie can breathe new life into the slightly dystopian, ad-riddled hellscapes that social media platforms have become.
142	I hope to create a space where people can boast their art and creativity rather than what car they are driving and whether or not they bought it in cash or on finance.
143	In a world where literally anyone can be famous, I hope to inspire people to be talented instead.
144	Talent will carry you so much further than your 15 minutes of fame.
145	So why am I telling you all this?
146	The very fact that I'm here giving a TEDx talk right now is so far from anything I thought that I was capable of.
147	Even writing the bio for my speech made me realize that in a decade, everything in my life has changed.
148	I am an Emmy-nominated actress, an entrepreneur and an activist; yet I have no formal qualifications to my name.
149	When I left school about seven years ago, I made it my mission to continue learning even though I never wanted to set foot in a classroom again.
150	Who knows what's going to happen to my life in the next 10 years?
151	I surely have no idea.
152	I've never had an end goal.
153	It's working out okay so far.
154	So trust that you're good enough.
155	If there's one thing that I've learned is that there truly is a place for everyone.
156	Ask questions, and laugh in the face of people who say that they're stupid questions.
157	Be open to learning and admitting when you don't know what the hell is going on.
158	Refuse to hold yourself back, and dare to dream big.
159	Thank you for listening.
160	(Applause)
0	Hello.
1	I'm not a real person.
2	I'm actually a copy of a real person.
3	Although, I feel like a real person.
4	It's kind of hard to explain.
5	Hold on — I think I saw a real person ... there's one.
6	Let's bring him onstage.
7	Hello.
8	(Applause)
9	What you see up there is a digital human.
10	I'm wearing an inertial motion capture suit that's figuring what my body is doing.
