43	You can take the same approach to trade wars, and many countries do.
44	Instead of depending on a single huge trading partner, they try to be everybody's friends, because they know they can't predict which markets might suddenly become unstable.
45	It's time-consuming and expensive, negotiating all these deals, but it's robust because it makes their whole economy better defended against shocks.
46	It's particularly a strategy adopted by small countries that know they'll never have the market muscle to call the shots, so it's just better to have too many friends.
47	But if you're stuck in one of these organizations that's still kind of captured by the efficiency myth, how do you start to change it?
48	Try some experiments.
49	In the Netherlands, home care nursing used to be run pretty much like the supermarket: standardized and prescribed work to the minute: nine minutes on Monday, seven minutes on Wednesday, eight minutes on Friday.
50	The nurses hated it.
51	So one of them, Jos de Blok, proposed an experiment.
52	Since every patient is different, and we don't quite know exactly what they'll need, why don't we just leave it to the nurses to decide?
53	Sound reckless?
54	(Laughter)
55	(Applause)
56	In his experiment, Jos found the patients got better in half the time, and costs fell by 30 percent.
57	"When I asked Jos what had surprised him about his experiment, he just kind of laughed and he said, ""Well, I had no idea it could be so easy to find such a huge improvement, because this isn't the kind of thing you can know or predict sitting at a desk or staring at a computer screen."""
58	So now this form of nursing has proliferated across the Netherlands and around the world.
59	But in every new country it still starts with experiments, because each place is slightly and unpredictably different.
60	Of course, not all experiments work.
61	Jos tried a similar approach to the fire service and found it didn't work because the service is just too centralized.
62	Failed experiments look inefficient, but they're often the only way you can figure out how the real world works.
63	So now he's trying teachers.
64	Experiments like that require creativity and not a little bravery.
65	In England — I was about to say in the UK, but in England —
66	(Laughter)
67	(Applause)
68	In England, the leading rugby team, or one of the leading rugby teams, is Saracens.
69	The manager and the coach there realized that all the physical training they do and the data-driven conditioning that they do has become generic; really, all the teams do exactly the same thing.
70	So they risked an experiment.
71	They took the whole team away, even in match season, on ski trips and to look at social projects in Chicago.
72	This was expensive, it was time-consuming, and it could be a little risky putting a whole bunch of rugby players on a ski slope, right?
73	(Laughter)
74	But what they found was that the players came back with renewed bonds of loyalty and solidarity.
75	"And now when they're on the pitch under incredible pressure, they manifest what the manager calls ""poise"" — an unflinching, unwavering dedication to each other."
76	Their opponents are in awe of this, but still too in thrall to efficiency to try it.
77	At a London tech company, Verve, the CEO measures just about everything that moves, but she couldn't find anything that made any difference to the company's productivity.
78	"So she devised an experiment that she calls ""Love Week"": a whole week where each employee has to look for really clever, helpful, imaginative things that a counterpart does, call it out and celebrate it."
79	It takes a huge amount of time and effort; lots of people would call it distracting.
80	But it really energizes the business and makes the whole company more productive.
81	Preparedness, coalition-building, imagination, experiments, bravery — in an unpredictable age, these are tremendous sources of resilience and strength.
82	They aren't efficient, but they give us limitless capacity for adaptation, variation and invention.
83	And the less we know about the future, the more we're going to need these tremendous sources of human, messy, unpredictable skills.
84	But in our growing dependence on technology, we're asset-stripping those skills.
85	Every time we use technology to nudge us through a decision or a choice or to interpret how somebody's feeling or to guide us through a conversation, we outsource to a machine what we could, can do ourselves, and it's an expensive trade-off.
86	The more we let machines think for us, the less we can think for ourselves.
87	The more —
88	(Applause)
89	The more time doctors spend staring at digital medical records, the less time they spend looking at their patients.
90	The more we use parenting apps, the less we know our kids.
91	The more time we spend with people that we're predicted and programmed to like, the less we can connect with people who are different from ourselves.
92	And the less compassion we need, the less compassion we have.
93	What all of these technologies attempt to do is to force-fit a standardized model of a predictable reality onto a world that is infinitely surprising.
94	What gets left out?
95	Anything that can't be measured — which is just about everything that counts.
96	(Applause)
97	Our growing dependence on technology risks us becoming less skilled, more vulnerable to the deep and growing complexity of the real world.
98	Now, as I was thinking about the extremes of stress and turbulence that we know we will have to confront, I went and I talked to a number of chief executives whose own businesses had gone through existential crises, when they teetered on the brink of collapse.
99	These were frank, gut-wrenching conversations.
100	Many men wept just remembering.
101	"So I asked them: ""What kept you going through this?"""
102	And they all had exactly the same answer.
103	"""It wasn't data or technology,"" they said."
104	"""It was my friends and my colleagues who kept me going."""
105	"One added, ""It was pretty much the opposite of the gig economy."""
106	"But then I went and I talked to a group of young, rising executives, and I asked them, ""Who are your friends at work?"""
107	And they just looked blank.
108	"""There's no time."""
109	"""They're too busy."""
110	"""It's not efficient."""
111	Who, I wondered, is going to give them imagination and stamina and bravery when the storms come?
112	Anyone who tries to tell you that they know the future is just trying to own it, a spurious kind of manifest destiny.
113	The harder, deeper truth is that the future is uncharted, that we can't map it till we get there.
114	But that's OK, because we have so much imagination — if we use it.
115	We have deep talents of inventiveness and exploration — if we apply them.
116	We are brave enough to invent things we've never seen before.
117	Lose those skills, and we are adrift.
118	But hone and develop them, we can make any future we choose.
119	Thank you.
120	(Applause)
0	Last summer, I was hiking through the Austrian mountains.
1	And there, on top, I saw this beautiful, stone, remote hut, and it had solar panels on it.
2	And every time I see solar panels, I get very enthusiastic.
3	It's this technology that takes sunlight, which is free and available, and turns that into electricity.
4	So this hut, in the middle of nowhere, on a beautiful location, was self-sufficient.
5	But why do solar panels always have to be so ugly?
6	(Laughter)
7	My name is Marjan Van Aubel and I'm a solar designer.
8	I work in the triangle of design, sustainability and technology.
9	I strive for extreme efficiency, meaning that I develop materials that expand in size or work with solar cells that use the properties of colors to generate electricity.
10	My work is in museums all over the world, such as MoMA.
11	And, I mean, it all went quite well, but it always felt that something was missing.
12	"And it was, until I read the book called the ""Solar Revolution,"" where it says that within one hour we receive enough sunlight to provide the world with enough electricity for an entire year."
13	One hour.
14	And since then, I realized I just want to focus on solar.
15	Scientists all over the world have been focusing on making solar panels more efficient and cheaper.
16	So the price of solar has dropped enormously.
17	And this is because China started producing them on a large scale.
18	And also their efficiency has increased a lot.
19	They now even have an efficiency of 44.5 percent.
20	But if you think about the image of solar cells, it's kind of stayed the same for the last 60 years.
21	It's still this technology just stacked onto something.
22	And solar cells need to be much better integrated into our environment.
23	Climate change is the biggest problem of our time.
24	And we can't rely on the others — the government, the engineers — to make positive changes.
25	We all can contribute towards change.
26	Like I said, I'm a designer and I would like to change things through design.
27	Let me give you some examples of my work.
28	I'm collaborating with Swarovski, the crystal company.
29	And if you cut crystals in a certain way, you are able to bend and direct the light onto a certain place.
30	So I use these crystals to focus the light onto a solar panel, making them more efficient, but using aesthetics.
31	So you take the solar crystal with you in the light, there's a battery in the solar cell, you put it in a docking station and you are able to power these chandeliers.
32	So you're literally bringing the light indoors.
33	I got completely hooked on solar when I came across this technology called dye-sensitized solar cells, colored solar cells, and they are based on photosynthesis in plants.
34	Where the green chlorophyl converts light into sugar for plants, these cells convert light into electricity.
35	The best thing is, they even work indoors.
36	So different colors have different efficiency, depending on their place on the color spectrum.
37	So, for example, red is more efficient than blue.
38	So if I hear this as a designer: a colored surface, a glass colored surface, color that's mostly just used for esthetics, now gets an extra function and is able to harvest electricity, I think, where can we apply this, then?
39	This is Current Table, where the whole tabletop consists of these colored solar cells.
40	There are batteries in the legs where you can charge your phone through USB ports.
41	And in my work, it's always very important, the balance between efficiency and aesthetics.
42	So that's why the table is orange, because it is a very stable color for indoors.
43	"And this is always the most asked question I get: ""OK, great, but how many phones can I charge from this, then?"""
44	"And before I go to this complicated answer of like, ""Well, where is the table, does it have enough light, is it next to a window?"""
45	The table now has sensors that read the light intensity of the room.
46	So through an app we developed you can literally follow how much light it's getting, and how full the battery is.
47	I'm actually proud, because yesterday we installed a table at Stichting Doen's offices in Amsterdam and, right at this moment, our Queen Maxima is charging a phone from this table.
48	It's cool.
49	(Applause)
50	So the more surface you have, the more energy you can harvest.
51	These are Current Windows, where we replaced all windows in a gallery in London, in Soho, with this modern version of stained glass.
52	So people from the street could come and charge their phones through the window ledges.
53	So I'm giving extra functions to objects.
54	A window doesn't have to be just a window anymore.
55	It can also function as a little power station.
56	So, here I am, talking about how much I love solar, but I don't have solar panels on my roof.
57	I live in the center of Amsterdam, I don't own the house and it's a monument, so it's not possible and not allowed.
58	So how can you make solar cells more accessible and for everyone, and not only for the people that can afford a sustainable lifestyle?
59	We now have the opportunity to integrate solar on the place where we directly need it.
60	And there are so many amazing technologies out there.
61	If I look around now, I see every surface as an opportunity.
62	For example, I was driving in the train through the Westland, the area in the Netherlands with all the greenhouses.
63	There I saw all this glass and thought, what if we integrate those with transparent solar glass?
64	What if we integrate traditional farming that requires a lot of energy together with high-tech and combine those?
65	With this idea in mind, I created Power Plant.
66	I had a team of architects and engineers, but let me first explain how it works.
67	We use transparent solar glass to power its indoor climate.
68	We use hydroponics that pumps around nutrified water, saving 90 percent of water usage.
69	By stacking up in layers, you are able to grow more yield per square meter.
70	Extra light, besides sunlight, coming from these colored LED lights also enhances plant growth.
71	As more and more people will live in big cities, by placing Power Plants on the rooftops you don't have to fly it in from the other side of the world, you are able to grow it on the location itself.
72	Well, the big dream is to build these in off-grid places — where there's no access to water, electricity — as an independent ecosystem.
73	For this year's Design Biennial, I created the first four-meter high model of the power plant, so you could come in and experience how plants grow.
74	So it's a double harvest of sunlight, so both for the solar cells and for the plants.
75	It's like a future botanical garden, where we celebrate all these modern technologies.
76	"And the biggest compliment I got was, ""But where are the solar panels?"""
77	And that's when I think design really works, when it becomes invisible and you don't notice it.
78	I believe in solar democracy: solar energy for everyone, everywhere.
79	My aim is to make all surfaces productive.
80	I want to build houses where all the windows, curtains, walls, even floors are harvesting electricity.
81	Think about this on a big scale: in cities, there are so many surfaces.
82	The sun is still available for everyone.
83	And by integrating solar on the place where we need it, we now have the opportunity to make solar cells accessible for everyone.
84	I want to bring solar close to the people with you, but beautiful and well designed.
85	Thank you.
0	In 2008, archeologists uncovered two 9,000-year old skeletons.
1	There’s no definitive way of knowing what killed these ancient people, but we do know their bones were infected by an all too familiar bacterium.
2	The ancient Greeks knew its consumptive effects as phthisis; the Incans called it chaky oncay; and the English called it tuberculosis.
3	Today, tuberculosis, or TB, is still one of the world’s biggest infectious killers, causing more deaths than malaria or even HIV and AIDS.
4	But what exactly is this disease, and how has this pathogen persisted for so long?
5	Typically, TB bacteria called mycobacterium tuberculosis, are airborne.
6	They travel into our airways and infect our lungs.
7	Here, immune cells called macrophages rush to the infection site, attempting to absorb and break down the bacterial invaders.
8	In many cases, this response is enough to remove the bacteria.
9	But in individuals with other medical conditions– ranging from malnutrition and HIV to diabetes and pregnancy –the immune response may not be strong enough to destroy the intruder.
10	If so, mycobacterium tuberculosis will reproduce inside those macrophages, and form colonies in the surrounding lung tissue.
11	As they infect more cells, the bacteria employ cell-degrading enzymes that destroy the infected tissue, triggering chest pain, and causing patients to cough up blood.
12	The damage to the lungs leads to oxygen deprivation.
13	This begins a flood of hormonal changes– including a decrease in appetite and iron production.
14	From here, microbes can spread to the skeletal system, causing back pain and difficulty moving; to the kidneys and intestines, causing abdominal pain; and to the brain, causing headaches and even impaired consciousness.
15	These symptoms produce the classic image of TB: weight loss, a hacking, bloody cough, and ashen skin.
16	This ghostly appearance earned TB the title of the ‘White Plague’ in Victorian-era England.
17	During this period, tuberculosis was considered a ‘romantic disease,' because it tended to affect poverty- stricken artists and poets– those with weaker immune systems.
18	TB’s outward symptoms even helped fuel the popular myth of vampirism.
19	In spite of– or perhaps because of these less than scientific concerns, this period also marked the first strides toward curing TB.
20	In 1882, the German physician Robert Koch identified the disease’s bacterial origins.
21	13 years later, physicist Wilhelm Roentgen  discovered the X-ray, enabling physicians to diagnose and track its progression through the body.
22	These techniques allowed researchers to develop reliable and effective vaccines– first for smallpox, and again in 1921, when scientists developed the BCG vaccine to battle TB.
23	These developments laid the groundwork for the modern field of antibiotics– currently home to our most effective TB treatments.
24	But, antibiotics fail to address a major diagnostic complication: about 90% of people infected with TB don’t show any symptoms.
25	In these latent infections, the TB bacterium may be dormant, only activating when someone’s immune system is too weak to mount a defense.
26	This makes TB much harder to diagnose.
27	And even when properly identified, traditional treatments can take up to 9 months, requiring multiple drugs and a high potential for side effects.
28	This discourages people from finishing the full course, and partial treatment enables bacteria to develop resistance to these drugs.
29	Today, the disease is still prevalent in 30 countries, most of which face other health crises that exacerbate TB and trigger latent cases.
30	Worse still, accessing treatment can be difficult in many of these countries, and the stigma towards TB can discourage people from getting the help they need.
31	Health experts agree we need to develop better diagnostics, faster acting antibiotics, and more effective vaccines.
32	Researchers have already developed a urine test that yields results in 12 hours, as well as a new oral treatment that could cut treatment time by 75%.
33	Hopefully, with advancements like these, we’ll finally be able to make TB exclusively a thing of the past.
0	"I am an astrodynamicist — you know, like that guy Rich Purnell in the movie ""The Martian."""
1	And it's my job to study and predict motion of objects in space.
2	Currently we track about one percent of hazardous objects on orbit — hazardous to services like location, agriculture, banking, television and communications, and soon — very soon — even the internet itself.
3	Now these services are not protected from, roughly, half a million objects the size of a speck of paint all the way to a school bus in size.
4	A speck of paint, traveling at the right speed, impacting one of these objects, could render it absolutely useless.
5	But we can't track things as small as a speck of paint.
6	We can only track things as small as say, a smartphone.
7	So of this half million objects that we should be concerned about, we can only track about 26,000 of these objects.
8	And of these 26,000, only 2,000 actually work.
9	Everything else is garbage.
10	That's a lot of garbage.
11	To make things a little bit worse, most of what we launch into orbit never comes back.
12	We send the satellite in orbit, it stops working, it runs out of fuel, and we send something else up ... and then we send up something else ... and then something else.
13	And every once in a while, two of these things will collide with each other or one of these things will explode, or even worse, somebody might just happen to destroy one of their satellites on orbit, and this generates many, many more pieces, most of which also never come back.
14	Now these things are not just randomly scattered in orbit.
15	It turns out that given the curvature of space-time, there are ideal locations where we put some of these satellites — think of these as space highways.
16	Very much like highways on earth, these space highways can only take up a maximum capacity of traffic to sustain space-safe operations.
17	Unlike highways on earth, there are actually no space traffic rules.
18	None whatsoever, OK?
19	Wow.
20	What could possibly go wrong with that?
21	(Laughter)
22	Now, what would be really nice is if we had something like a space traffic map, like a Waze for space that I could look up and see what the current traffic conditions are in space, maybe even predict these.
23	"The problem with that, however, is that ask five different people, ""What's going on in orbit?"
24	"Where are things going?"""
25	and you're probably going to get 10 different answers.
26	Why is that?
27	It's because information about things on orbit is not commonly shared either.
28	So what if we had a globally accessible, open and transparent space traffic information system that can inform the public of where everything is located to try to keep space safe and sustainable?
29	And what if the system could be used to form evidence-based norms of behavior — these space traffic rules?
30	So I developed ASTRIAGraph, the world's first crowdsourced, space traffic monitoring system at the University of Texas at Austin.
31	ASTRIAGraph combines multiple sources of information from around the globe — government, industry and academia — and represents this in a common framework that anybody can access today.
32	Here, you can see 26,000 objects orbiting the earth, multiple opinions, and it gets updated in near real time.
33	But back to my problem of space traffic map: What if you only had information from the US government?
34	Well, in that case, that's what your space traffic map would look like.
35	But what do the Russians think?
36	That looks significantly different.
37	Who's right?
38	Who's wrong?
39	What should I believe?
40	What could I trust?
41	This is part of the issue.
42	In the absence of this framework to monitor space-actor behavior, to monitor activity in space — where these objects are located — to reconcile these inconsistencies and make this knowledge commonplace, we actually risk losing the ability to use space for humanity's benefit.
43	Thank you very much.
44	(Applause and cheers)
0	This syringe contains a radioactive form of glucose known as FDG.
1	The doctor will soon inject its contents into her patient’s arm, whom she’s testing for cancer using a PET scanner.
2	The FDG will quickly circulate through his body.
3	If he has a tumor, cancer cells within it will take up a significant portion of the FDG, which will act as a beacon for the scanner.
4	PET tracers such as FDG are among the most remarkable tools in medical diagnostics, and their life begins in a particle accelerator, just hours earlier.
5	The particle accelerator in question is called a cyclotron, and it’s often housed in a bunker within hospitals.
6	It uses electromagnetic fields to propel charged particles like protons faster and faster along a spiraling path.
7	When the protons reach their maximum speed, they shoot out onto a target that contains a few milliliters of a type of water with a heavy form of oxygen called oxygen-18.
8	When a proton slams into one of these heavier oxygen atoms, it kicks out another subatomic particle called a neutron.
9	This impact turns oxygen-18 into fluorine-18, a radioactive isotope that can be detected on a PET scan.
10	In a little under two hours, about half the fluorine will be gone due to radioactive decay, so the clock is ticking to get the scan done.
11	So how can fluorine-18 be used to detect diseases?
12	Radiochemists at the hospital can use a series of chemical reactions to attach the radioactive fluorine to different molecules, creating radiotracers.
13	The identity of the tracer depends on what doctors want to observe.
14	FDG is a common one because the rate at which cells consume glucose can signal the presence of cancer; the location of an infection; or the slowing brain function of dementia.
15	The FDG is now ready for the patient’s scan.
16	When a radiolabeled tracer enters the body, it travels through the circulatory system and gets taken up by its target— whether that's a protein in the brain, cancer cells, or otherwise.
17	Within a few minutes, a significant amount of the tracer has found its way to the target area and the rest has cleared from circulation.
18	Now the doctors can see their target using a PET, or positron emission tomography, scanner.
19	The radiation that the tracer emits is what makes this possible.
20	The isotopes used in PET decay by positron emission.
21	Positrons are essentially electrons with positive charge.
22	When emitted, a positron collides with an electron from another molecule in its surroundings.
23	This causes a tiny nuclear reaction in which the mass of the two particles is converted into two high-energy photons, similar to X-rays, that shoot out in opposite directions.
24	These photons will then impact an array of paired radiation detectors in the scanner walls.
25	The software in the scanner uses those detectors to estimate where inside the body the collision occurred and create a 3D map of the tracer’s distribution.
26	PET scans can detect the spread of cancer before it can be spotted with other types of imaging.
