93	That means there is nothing to feel, so we can have a very, very flexible interface.
94	Now, I use this as a mouse to approach skin, a muscular arm, so now let's feel his biceps, or shoulders.
95	So now you see how much stiffer it becomes.
96	Let's explore even more.
97	Let's approach the ribcage.
98	And as soon as I move on top of the ribcage and between the intercostal muscles, which is softer and harder, I can feel the difference of the stiffness.
99	Take my word for it.
100	So now you see, it's much stiffer in terms of the force it's giving back to my fingertip.
101	So I showed you the surfaces that aren't moving.
102	How about if I were to approach something that moves, for example, like a beating heart?
103	What would I feel?
104	(Applause)
105	This can be your beating heart.
106	This can actually be inside your pocket while you're shopping online.
107	Now you'll be able to feel the difference of the sweater that you're buying, how soft it is, if it's actually cashmere or not, or the bagel that you're trying to buy, how hard it is or how crispy it is.
108	This is now possible.
109	The robotics technology is advancing to be more personalized and adaptive, to adapt to our everyday needs.
110	This unique specie of reconfigurable robotics is actually the platform to provide this invisible, intuitive interface to meet our exact needs.
111	These robots will no longer look like the characters from the movies.
112	Instead, they will be whatever you want them to be.
113	Thank you.
114	(Applause)
0	So, a little while ago, members of my family had three bits of minor surgery, about a half hour each, and we got three sets of bills.
1	For the first one, the anesthesia bill alone was 2,000 dollars; the second one, 2,000 dollars; the third one, 6,000 dollars.
2	So I'm a journalist.
3	I'm like, what's up with that?
4	I found out that I was actually, for the expensive one, being charged 1,419 dollars for a generic anti-nausea drug that I could buy online for two dollars and forty-nine cents.
5	I had a long and unsatisfactory argument with the hospital, the insurer and my employer.
6	Everybody agreed that this was totally fine.
7	But it got me thinking, and the more I talked to people, the more I realized: nobody has any idea what stuff costs in health care.
8	Not before, during or after that procedure or test do you have any idea what it's going to cost.
9	"It's only months later that you get an ""explanation of benefits"" that explains exactly nothing."
10	So this came back to me a little while later.
11	I had volunteered for a buyout from the New York Times, where I had worked for more than 20 years as a journalist.
12	I was looking for my next act.
13	It turned out that next act was to build a company telling people what stuff costs in health care.
14	"I won a ""Shark Tank""-type pitch contest to do just that."
15	Health costs ate up almost 18 percent of our gross domestic product last year, but nobody has any idea what stuff costs.
16	But what if we did know?
17	So we started out small.
18	We called doctors and hospitals and asked them what they would accept as a cash payment for simple procedures.
19	Some people were helpful.
20	A lot of people hung up on us.
21	Some people were just plain rude.
22	"They said, ""We don't know,"" or, ""Our lawyers won't let us tell you that,"" though we did get a lot of information."
23	We found, for example, that here in the New York area, you could get an echocardiogram for 200 dollars in Brooklyn or for 2,150 dollars in Manhattan, just a few miles away.
24	New Orleans, the same simple blood test, 19 dollars over here, 522 dollars just a few blocks away.
25	San Francisco, the same MRI, 475 dollars or 6,221 dollars just 25 miles away.
26	These pricing variations existed for all the procedures and all the cities that we surveyed.
27	Then we started to ask people to tell us their health bills.
28	In partnership with public radio station WNYC here in New York, we asked women to tell us the prices of their mammograms.
29	People told us nobody would do that, that it was too personal.
30	But in the space of three weeks, 400 women told us about their prices.
31	Then we started to make it easier for people to share their data into our online searchable database.
32	It's sort of like a mash-up of Kayak.com and the Waze traffic app for health care.
33	(Laughter)
34	We call it a community-created guide to health costs.
35	Our survey and crowdsourcing work grew into partnerships with top newsrooms nationwide — in New Orleans, Philadelphia, San Francisco, Los Angeles, Miami and other places.
36	"We used the data to tell stories about people who were suffering and how to avoid that suffering, to avoid that ""gotcha"" bill."
37	A woman in New Orleans saved nearly 4,000 dollars using our data.
38	A San Francisco contributor saved nearly 1,300 dollars by putting away his insurance card and paying cash.
39	There are a lot of people who are going to in-network hospitals and getting out-of-network bills.
40	And then there was the hospital that continued to bill a dead man.
41	We learned that thousands of people wanted to tell us their prices.
42	They want to learn what stuff costs, find out how to argue a bill, help us solve this problem that's hurting them and their friends and families.
43	We talked to people who had to sell a car to pay a health bill, go into bankruptcy, skip a treatment because of the cost.
44	Imagine if you could afford the diagnosis but not the cure.
45	We set off a huge conversation about costs involving doctors and hospitals, yes, but also their patients, or as we like to call them, people.
46	(Laughter)
47	We changed policy.
48	A consumer protection bill that had been stalled in the Louisiana legislature for 10 years passed after we launched.
49	Let's face it: this huge, slow-rolling public health crisis is a national emergency.
50	And I don't think government's going to help us out anytime soon.
51	But what if the answer was really simple: make all the prices public all the time.
52	Would our individual bills go down?
53	Our health premiums?
54	Be really clear about this: this is a United States problem.
55	In most of the rest of the developed world, sick people don't have to worry about money.
56	It's also true that price transparency will not solve every problem.
57	There will still be expensive treatments, huge friction from our insurance system.
58	There will still be fraud and a massive problem with overtreatment and overdiagnosis.
59	And not everything is shoppable.
60	Not everybody wants the cheapest appendectomy or the cheapest cancer care.
61	But when we talk about these clear effects, we're looking at a real issue that's actually very simple.
62	When we first started calling for prices, we actually felt like we were going to be arrested.
63	It seemed kind of transgressive to talk about medicine and health care in the same breath, and yet it became liberating, because we found not only data but also good and honest people out there in the system who want to help folks get the care they need at a price they can afford.
64	And it got easier to ask.
65	So I'll leave you with some questions.
66	What if we all knew what stuff cost in health care in advance?
67	What if, every time you Googled for an MRI, you got drop-downs telling you where to buy and for how much, the way you do when you Google for a laser printer?
68	What if all of the time and energy and money that's spent hiding prices was squeezed out of the system?
69	What if each one of us could pick the $19 test every time instead of the $522 one?
70	Would our individual bills go down?
71	Our premiums?
72	I don't know, but if you don't ask, you'll never know.
73	And you might save a ton of money.
74	And I've got to think that a lot of us and the system itself would be a lot healthier.
75	Thank you.
76	(Applause)
0	In 132 CE, Chinese polymath Zhang Heng presented the Han court with his latest invention.
1	This large vase, he claimed, could tell them whenever an earthquake occurred in their kingdom– including the direction they should send aid.
2	The court was somewhat skeptical, especially when the device triggered on a seemingly quiet afternoon.
3	But when messengers came for help days later, their doubts turned to gratitude.
4	Today, we no longer rely on pots to identify seismic events, but earthquakes still offer a unique challenge to those trying to track them.
5	So why are earthquakes so hard to anticipate, and how could we get better at predicting them?
6	To answer that, we need to understand some theories behind how earthquakes occur.
7	Earth’s crust is made from several vast, jagged slabs of rock called tectonic plates, each riding on a hot, partially molten layer of Earth’s mantle.
8	This causes the plates to spread very slowly, at anywhere from 1 to 20 centimeters per year.
9	But these tiny movements are powerful enough to cause deep cracks in the interacting plates.
10	And in unstable zones, the intensifying pressure may ultimately trigger an earthquake.
11	It’s hard enough to monitor these miniscule movements, but the factors that turn shifts into seismic events are far more varied.
12	Different fault lines juxtapose different rocks– some of which are stronger–or weaker– under pressure.
13	Diverse rocks also react differently to friction and high temperatures.
14	Some partially melt, and can release lubricating fluids made of superheated minerals that reduce fault line friction.
15	But some are left dry, prone to dangerous build-ups of pressure.
16	And all these faults are subject to varying gravitational forces, as well as the currents of hot rocks moving throughout Earth’s mantle.
17	So which of these hidden variables should we be analyzing, and how do they fit into our growing prediction toolkit?
18	Because some of these forces occur at largely constant rates, the behavior of the plates is somewhat cyclical.
19	Today, many of our most reliable clues come from long-term forecasting, related to when and where earthquakes have previously occurred.
20	At the scale of millennia, this allows us to make predictions about when highly active faults, like the San Andreas, are overdue for a massive earthquake.
21	But due to the many variables involved, this method can only predict very loose timeframes.
22	To predict more imminent events, researchers have investigated the vibrations Earth elicits before a quake.
23	Geologists have long used seismometers to track and map these tiny shifts in the earth’s crust.
24	And today, most smartphones are also capable of recording primary seismic waves.
25	With a network of phones around the globe, scientists could potentially crowdsource a rich, detailed warning system that alerts people to incoming quakes.
26	Unfortunately, phones might not be able to provide the advance notice needed to enact safety protocols.
27	But such detailed readings would still be useful for prediction tools like NASA’s Quakesim software, which can use a rigorous blend of geological data to identify regions at risk.
28	However, recent studies indicate the most telling signs of a quake might be invisible to all these sensors.
29	In 2011, just before an earthquake struck the east coast of Japan, nearby researchers recorded surprisingly high concentrations of the radioactive isotope pair: radon and thoron.
30	As stress builds up in the crust right before an earthquake, microfractures allow these gases to escape to the surface.
31	These scientists think that if we built a vast network of radon-thoron detectors in earthquake-prone areas, it could become a promising warning system– potentially predicting quakes a week in advance.
32	Of course, none of these technologies would be as helpful as simply looking deep inside the earth itself.
33	With a deeper view we might be able to track and predict large-scale geological changes in real time, possibly saving tens of thousands of lives a year.
34	But for now, these technologies can help us prepare and respond quickly to areas in need– without waiting for directions from a vase.
0	So let me with start with Roy Amara.
1	Roy's argument is that most new technologies tend to be overestimated in their impact to begin with, and then they get underestimated in the long term because we get used to them.
2	These really are days of miracle and wonder.
3	You remember that wonderful song by Paul Simon?
4	There were two lines in it.
5	So what was it that was considered miraculous back then?
6	Slowing down things — slow motion — and the long-distance call.
7	"Because, of course, you used to get interrupted by operators who'd tell you, ""Long distance calling."
8	"Do you want to hang up?"""
9	And now we think nothing of calling all over the world.
10	Well, something similar may be happening with reading and programming life.
11	But before I unpack that, let's just talk about telescopes.
12	Telescopes were overestimated originally in their impact.
13	This is one of Galileo's early models.
14	People thought it was just going to ruin all religion.
15	(Laughter)
16	So we're not paying that much attention to telescopes.
17	But, of course, telescopes launched 10 years ago, as you just heard, could take this Volkswagen, fly it to the moon, and you could see the lights on that Volkswagen light up on the moon.
18	And that's the kind of resolution power that allowed you to see little specks of dust floating around distant suns.
19	Imagine for a second that this was a sun a billion light years away, and you had a little speck of dust that came in front of it.
20	That's what detecting an exoplanet is like.
21	And the cool thing is, the telescopes that are now being launched would allow you to see a single candle lit on the moon.
22	And if you separated it by one plate, you could see two candles separately at that distance.
23	And that's the kind of resolution that you need to begin to image that little speck of dust as it comes around the sun and see if it has a blue-green signature.
24	And if it does have a blue-green signature, it means that life is common in the universe.
25	The first time you ever see a blue-green signature on a distant planet, it means there's photosynthesis there, there's water there, and the chances that you saw the only other planet with photosynthesis are about zero.
26	And that's a calendar-changing event.
27	There's a before and after we were alone in the universe: forget about the discovery of whatever continent.
28	So as you're thinking about this, we're now beginning to be able to image most of the universe.
29	And that is a time of miracle and wonder.
30	And we kind of take that for granted.
31	Something similar is happening in life.
32	So we're hearing about life in these little bits and pieces.
33	We hear about CRISPR, and we hear about this technology, and we hear about this technology.
34	But the bottom line on life is that life turns out to be code.
35	And life as code is a really important concept because it means, just in the same way as you can write a sentence in English or in French or Chinese, just in the same way as you can copy a sentence, just in the same way as you can edit a sentence, just in the same way as you can print a sentence, you're beginning to be able to do that with life.
36	It means that we're beginning to learn how to read this language.
37	And this, of course, is the language that is used by this orange.
38	So how does this orange execute code?
39	It doesn't do it in ones and zeroes like a computer does.
40	It sits on a tree, and one day it does: plop!
41	And that means: execute.
42	AATCAAG: make me a little root.
43	TCGACC: make me a little stem.
44	GAC: make me some leaves.
45	AGC: make me some flowers.
46	And then GCAA: make me some more oranges.
47	If I edit a sentence in English on a word processor, then what happens is you can go from this word to that word.
48	If I edit something in this orange and put in GCAAC, using CRISPR or something else that you've heard of, then this orange becomes a lemon, or it becomes a grapefruit, or it becomes a tangerine.
49	And if I edit one in a thousand letters, you become the person sitting next to you today.
50	Be more careful where you sit.
51	(Laughter)
52	What's happening on this stuff is it was really expensive to begin with.
53	It was like long-distance calls.
54	But the cost of this is dropping 50 percent faster than Moore's law.
55	The first $200 full genome was announced yesterday by Veritas.
56	And so as you're looking at these systems, it doesn't matter, it doesn't matter, it doesn't matter, and then it does.
57	So let me just give you the map view of this stuff.
58	This is a big discovery.
59	There's 23 chromosomes.
60	Cool.
61	Let's now start using a telescope version, but instead of using a telescope, let's use a microscope to zoom in on the inferior of those chromosomes, which is the Y chromosome.
62	It's a third the size of the X.
63	It's recessive and mutant.
64	But hey, just a male.
65	And as you're looking at this stuff, here's kind of a country view at a 400 base pair resolution level, and then you zoom in to 550, and then you zoom in to 850, and you can begin to identify more and more genes as you zoom in.
66	Then you zoom in to the state level, and you can begin to tell who's got leukemia, how did they get leukemia, what kind of leukemia do they have, what shifted from what place to what place.
67	And then you zoom in to the Google street view level.
68	So this is what happens if you have colorectal cancer for a very specific patient on the letter-by-letter resolution.
69	So what we're doing in this stuff is we're gathering information and just generating enormous amounts of information.
70	This is one of the largest databases on the planet and it's growing faster than we can build computers to store it.
71	You can create some incredible maps with this stuff.
72	You want to understand the plague and why one plague is bubonic and the other one is a different kind of plague and the other one is a different kind of plague?
73	Well, here's a map of the plague.
74	Some are absolutely deadly to humans, some are not.
75	And note, by the way, as you go to the bottom of this, how does it compare to tuberculosis?
76	So this is the difference between tuberculosis and various kinds of plagues, and you can play detective with this stuff, because you can take a very specific kind of cholera that affected Haiti, and you can look at which country it came from, which region it came from, and probably which soldier took that from that African country to Haiti.
77	Zoom out.
78	It's not just zooming in.
79	This is one of the coolest maps ever done by human beings.
80	What they've done is taken all the genetic information they have about all the species, and they've put a tree of life on a single page that you can zoom in and out of.
81	So this is what came first, how did it diversify, how did it branch, how large is that genome, on a single page.
82	It's kind of the universe of life on Earth, and it's being constantly updated and completed.
83	And so as you're looking at this stuff, the really important change is the old biology used to be reactive.
84	You used to have a lot of biologists that had microscopes, and they had magnifying glasses and they were out observing animals.
85	The new biology is proactive.
86	You don't just observe stuff, you make stuff.
87	And that's a really big change because it allows us to do things like this.
88	And I know you're really excited by this picture.
89	(Laughter)
90	It only took us four years and 40 million dollars to be able to take this picture.
91	(Laughter)
92	And what we did is we took the full gene code out of a cell — not a gene, not two genes, the full gene code out of a cell — built a completely new gene code, inserted it into the cell, figured out a way to have the cell execute that code and built a completely new species.
93	So this is the world's first synthetic life form.
94	And so what do you do with this stuff?
95	Well, this stuff is going to change the world.
96	Let me give you three short-term trends in terms of how it's going to change the world.
97	The first is we're going to see a new industrial revolution.
98	And I actually mean that literally.
99	So in the same way as Switzerland and Germany and Britain changed the world with machines like the one you see in this lobby, created power — in the same way CERN is changing the world, using new instruments and our concept of the universe — programmable life forms are also going to change the world because once you can program cells in the same way as you program your computer chip, then you can make almost anything.
100	So your computer chip can produce photographs, can produce music, can produce film, can produce love letters, can produce spreadsheets.
101	It's just ones and zeroes flying through there.
102	If you can flow ATCGs through cells, then this software makes its own hardware, which means it scales very quickly.
103	No matter what happens, if you leave your cell phone by your bedside, you will not have a billion cell phones in the morning.
104	But if you do that with living organisms, you can make this stuff at a very large scale.
105	One of the things you can do is you can start producing close to carbon-neutral fuels on a commercial scale by 2025, which we're doing with Exxon.
106	But you can also substitute for agricultural lands.
107	Instead of having 100 hectares to make oils or to make proteins, you can make it in these vats at 10 or 100 times the productivity per hectare.
108	Or you can store information, or you can make all the world's vaccines in those three vats.
109	Or you can store most of the information that's held at CERN in those three vats.
110	DNA is a really powerful information storage device.
111	Second turn: you're beginning to see the rise of theoretical biology.
112	So, medical school departments are one of the most conservative places on earth.
113	The way they teach anatomy is similar to the way they taught anatomy 100 years ago.
114	"""Welcome, student."
115	"Here's your cadaver."""
116	One of the things medical schools are not good at is creating new departments, which is why this is so unusual.
117	Isaac Kohane has now created a department based on informatics, data, knowledge at Harvard Medical School.
118	And in a sense, what's beginning to happen is biology is beginning to get enough data that it can begin to follow the steps of physics, which used to be observational physics and experimental physicists, and then started creating theoretical biology.
119	Well, that's what you're beginning to see because you have so many medical records, because you have so much data about people: you've got their genomes, you've got their viromes, you've got their microbiomes.
120	And as this information stacks, you can begin to make predictions.
121	The third thing that's happening is this is coming to the consumer.
122	So you, too, can get your genes sequenced.
123	And this is beginning to create companies like 23andMe, and companies like 23andMe are going to be giving you more and more and more data, not just about your relatives, but about you and your body, and it's going to compare stuff, and it's going to compare stuff across time, and these are going to become very large databases.
124	But it's also beginning to affect a series of other businesses in unexpected ways.
125	Normally, when you advertise something, you really don't want the consumer to take your advertisement into the bathroom to pee on.
126	Unless, of course, if you're IKEA.
127	Because when you rip this out of a magazine and you pee on it, it'll turn blue if you're pregnant.
128	(Laughter)
129	And they'll give you a discount on your crib.
130	(Laughter)
131	Right?
132	So when I say consumer empowerment, and this is spreading beyond biotech, I actually really mean that.
133	We're now beginning to produce, at Synthetic Genomics, desktop printers that allow you to design a cell, print a cell, execute the program on the cell.
134	We can now print vaccines real time as an airplane takes off before it lands.
135	We're shipping 78 of these machines this year.
136	This is not theoretical biology.
137	This is printing biology.
138	Let me talk about two long-term trends that are coming at you over a longer time period.
139	The first one is, we're starting to redesign species.
140	And you've heard about that, right?
141	We're redesigning trees.
142	We're redesigning flowers.
143	We're redesigning yogurt, cheese, whatever else you want.
144	And that, of course, brings up the interesting question: How and when should we redesign humans?
145	"And a lot of us think, ""Oh no, we never want to redesign humans."""
146	Unless, of course, if your child has a Huntington's gene and is condemned to death.
147	Or, unless if you're passing on a cystic fibrosis gene, in which case, you don't just want to redesign yourself, you want to redesign your children and their children.
148	And these are complicated debates and they're going to happen in real time.
149	I'll give you one current example.
150	One of the debates going on at the National Academies today is you have the power to put a gene drive into mosquitoes so that you will kill all the malaria-carrying mosquitoes.
151	"Now, some people say, ""That's going to affect the environment in an extreme way, don't do it."""
152	"Other people say, ""This is one of the things that's killing millions of people yearly."
153	"Who are you to tell me that I can't save the kids in my country?"""
154	And why is this debate so complicated?
155	Because as soon as you let this loose in Brazil or in Southern Florida — mosquitoes don't respect walls.
156	You're making a decision for the world when you put a gene drive into the air.
